,title,price,rating,total_reviews,availability_status,manufacturer,country_of_origin,os,ram,product_dimensions,weight,batteries,special_features,form_factor,colour,battery_power_rating,product_description,reviews,reviews_rating,Category
180,Google Pixel 3 XL (Not Pink 64 GB) (4 GB RAM),₹6999.00,4.2 out of 5 stars,67307 ratings,In stock on August 23 2021.,Vivo,India,Android 11,4 GB,15.9 x 0.8 x 7.4 cm, 185.5 Grams,1 Lithium ion batteries required. (included),"Dual SIM, GPS, Video Player, Music Player",Touchscreen Phone,Celestial Silver,3300,Samsung Galaxy M42 5G is Samsung's #FastestMonster equipped with the blazing fast Snapdragon 750G processor. It comes with a long lasting 5000 mAh battery and a versatile 48MP Quad camera for capturing stunning photos and videos along with a Super AMOLED Infinity-U 6.6” display for an true-to-life viewing experience. It is also equipped with the latest OneUI 3.1 defence grade knox security and Samsung Pay.,Some extra to know|| Flagship killer|| Best in Market|| Pleae Read before U purchase|| Wrost phone in this price|| Not matching the hype. Amazon removed my earlier comment|| If your purpose is gaming then go iqoo or else mi 11x is better value for money|| Only hipe. Nothing New.|| All rounder under 30K|| Poor battery performance,2.0 out of 5 stars|| 4.0 out of 5 stars|| 1.0 out of 5 stars|| 1.0 out of 5 stars|| 3.0 out of 5 stars|| 5.0 out of 5 stars|| 1.0 out of 5 stars|| 1.0 out of 5 stars|| 2.0 out of 5 stars|| 3.0 out of 5 stars,"['Battery', 'Performance', 'Price']"
181,Realme Narzo 30 5G (Racing Silver 6GB RAM 128GB Storage) Without Offers,₹10999.00,4.3 out of 5 stars,21077 ratings,In stock.,Xiaomi,India,Android,12 GB,16.5 x 7.6 x 0.7 cm, 105 Grams,1 Lithium Polymer batteries required. (included),"Quad-Core Processor, Dual Band, Face Unlock, Camera, LTE",Bar,Light Blue,4300,Say hello to the stylish and powerful realme C11 smartphone. Featuring 2 GB of RAM this smartphone offers a powerful and seamless performance whether you’re playing games or multitasking between applications. The 5000 mAh battery offers a long runtime so you can watch movies play games listen to music and do more in a day before you need to recharge it. The 16.5 cm (6.5) Mini-drop Fullscreen display makes it a delight to watch videos and more on this smartphone.,Mobile is great specifications but redmi please stop fake sale|| Never buy|| Wait for Poco version of the same|| Please Read this Review Carefully before you buy this.|| WORST PRODUCT EVER PURCHASE|| Very bad product (mobile) of my life|| Bad tactics by redmi 👎|| Hanging phone|| Best phone under 14000|| Best profitable phone,5.0 out of 5 stars|| 5.0 out of 5 stars|| 5.0 out of 5 stars|| 5.0 out of 5 stars|| 4.0 out of 5 stars|| 5.0 out of 5 stars|| 5.0 out of 5 stars|| 1.0 out of 5 stars|| 4.0 out of 5 stars|| 2.0 out of 5 stars,[]
182,OnePlus 9 5G (Astral Black 8GB RAM 128GB Storage),₹21999.00,4.2 out of 5 stars,943 ratings,Only 1 left in stock.,Vivo Mobile India Pvt Ltd,India,"HiOS 7.5, Android 11 (Go Edition)",6 GB,16.4 x 0.8 x 7.6 cm, 193 Grams,1 A batteries required. (included),"Camera, Rear Camera, Front Camera",Touchscreen Phone,Lunar White,6000,Packed with a host of features it scores high in terms of functionality. This makes it a must-have.,Hang|| I request that please work on camera and available the new software update for update the camera.|| Worst Phone Dont Buy|| Poor camera quality and Display quality|| Skip don't buy. Just don't !!!|| Worst phone|| worst product and worst customer service.|| Reasonable deal at this price Go for it🔥🔥|| Best camera|| The phone is average,5.0 out of 5 stars|| 1.0 out of 5 stars|| 4.0 out of 5 stars|| 1.0 out of 5 stars|| 5.0 out of 5 stars|| 3.0 out of 5 stars|| 1.0 out of 5 stars|| 1.0 out of 5 stars|| 4.0 out of 5 stars|| 3.0 out of 5 stars,"['Camera', 'Screen', 'Price', 'Build Quality']"
183,iQOO Z3 5G (Ace Black 8GB RAM 128GB Storage) | India's First SD 768G 5G Processor | 55W FlashCharge | Upto 6 Months No Cost EMI | Extra Rs.2000 Off on Exchange,₹9999.00,4.3 out of 5 stars,66356 ratings,In stock.,Samsung India Electronics Private Limited,India,MiUI 12.5 (Android 11),8 GB,16.5 x 0.9 x 7.6 cm, 191 Grams,1 Lithium Polymer batteries required. (included),"Dual SIM, Side fingerprint, Fingerprint Sensor, Bigger Battery, Smartphone",Bar,Racing Silver,5020,Colour: Cosmic Black | Size name: 128 GB Experience flagship performance with this smartphone’s Qualcomm Snapdragon 865 processor 7nm) with support for 5G. Loaded with a 64 MP triple-rear-camera system and a 20-megapixel front camera this phone ensures that your photography needs are well taken care of. Built-in features such as 8K Ultra-HD video recordign 6 Long Exposure Modes Magic Clone Video/Photo Timed Burst Dual Video and 4 Premium Filters help this phone capture amazing pictures and videos. MI 10T Pro has a 16.94cm6.67) large 144Hz Intelligent AdaptiveSync display and uses an industry-leading colour management to achieve true colorJNCD ≃ 0.39). 5000 large mAh large battery with 33W Dual-Split Fast Charge Technology helps charge it back to 100% in about 60 minutes.,Overall a good phone 👌|| Dont buy.. after 10 to.15 mins gaming phone lagging too much|| Not good|| Worst|| Don't buy. Reviewed on 31.10.2020|| Good phone..|| Loll !! I am the first to review this 🤩👇|| Excellent choice at this price|| Not good like other phones of xiaomi.|| Everything nice but only body vibration problem due to plastic back,5.0 out of 5 stars|| 1.0 out of 5 stars|| 4.0 out of 5 stars|| 1.0 out of 5 stars|| 5.0 out of 5 stars|| 1.0 out of 5 stars|| 1.0 out of 5 stars|| 5.0 out of 5 stars|| 5.0 out of 5 stars|| 1.0 out of 5 stars,['Price']
184,iQOO 7 5G (Solid Ice Blue 8GB RAM 256GB Storage)| Upto 9 Months No Cost EMI | 3GB Extended RAM | Extra Rs.2000 Off on Exchange,₹13990.00,4.1 out of 5 stars,14576 ratings,In stock on August 5 2021.,iQOO,India,"OneUI 3.1, Android 11.0",6 GB,16.9 x 7.5 x 0.8 cm, 120 Grams,1 Lithium ion batteries required. (included),Front Camera,Touchscreen Phone,Laser Blue,5020,Introducing Galaxy S20 FE 5G powered by Qualcomm Snapdragon 865 Octa-Core processor. 8GB RAM with 128GB internal memory expandable up to 1TB. Pro Grade Triple Rear Camera with 30X Space Zoom Single Take & Night Mode 32megapixels F2.2 Front Punch Hole Camera. 6.5-inch(16.40 centimeters) Infinity-O Super AMOLED Display with 120Hz Refresh rate. 4500 mAh battery with Super Fast Charging Fast Wireless Charging & Finger Print sensor.,ARE YOU SELLING GOLD CHAIN ? REDUCE PRICE|| Used one should be around 45-46k max|| Nice product|| Mobile IS Brand New Condition|| BANG FOR BUCKS|| One plus 8 pro Mobile is best working Mobile phones|| Like new but Warp charge cable missing|| Not use by camera|| Renewed products are good sometimes|| Completely satisfied 😊,4.0 out of 5 stars|| 5.0 out of 5 stars|| 4.0 out of 5 stars|| 5.0 out of 5 stars|| 5.0 out of 5 stars|| 5.0 out of 5 stars|| 4.0 out of 5 stars|| 5.0 out of 5 stars|| 1.0 out of 5 stars|| 5.0 out of 5 stars,"['Camera', 'Battery', 'Price']"
185,Tecno Spark 5 Pro (Seabed Blue 4GB RAM 64GB Storage),₹44990.00,2.4 out of 5 stars,10 ratings,In stock.,G MOBILES PVT LTD,India,Android,8 GB,16 x 0.8 x 7.4 cm, 185.5 Grams,1 Lithium ion batteries required. (included),"Dual SIM, Infrared, E-mail, Accelerometer, Ambient light sensor, Gyroscope, GPS, Video Player, Music Player, Proximity sensor",Bar,Storm Black,4500,The all New OnePlus 9 Flagship is here. The New OnePlus 9 comes with Snapdragon 888 Processor a Rear Triple Camera setup Co-Developed by Hassleblad 6.55 Inches 120 HZ Fliud AMOLED display 65W Warp Charging. The device is 5G enabled NFC enabled,Mobile is great specifications but redmi please stop fake sale|| Never buy|| Wait for Poco version of the same|| Please Read this Review Carefully before you buy this.|| WORST PRODUCT EVER PURCHASE|| Very bad product (mobile) of my life|| Bad tactics by redmi 👎|| Hanging phone|| Best phone under 14000|| Best profitable phone,1.0 out of 5 stars|| 3.0 out of 5 stars|| 5.0 out of 5 stars|| 1.0 out of 5 stars|| 5.0 out of 5 stars|| 5.0 out of 5 stars|| 5.0 out of 5 stars|| 5.0 out of 5 stars|| 5.0 out of 5 stars|| 5.0 out of 5 stars,[]
186,Samsung Galaxy F62 (Laser Blue 8GB RAM 128GB Storage),₹7499.00,4.2 out of 5 stars,4 ratings,In stock.,iQOO,India,Funtouch OS 11 (Based on Android 11),4 GB,16.39 x 7.53 x 0.85 cm, 173 Grams,1 Lithium ion batteries required. (included),"Bluetooth Tethering, Dual SIM, USB, Primary Camera, Radio, GPS, Flashlight, Wifi",Bar,Cosmic Black,5000,With Samsung Galaxy M31s Samsung introduces a 6000 mAh battery with a 25 Watt Fast charger for the first time in this price segment- along with all round features comprising of a 64 MP rear camera in Quad camera set up and an immersive + sAMOLED Infinity-O Display.,Good for this Money|| First 24-Hours Review !!|| Worst Product|| Not a good buy|| Camera is worst not worthy to buy|| Back designed and Fingerprint .|| Poor front camera and battery.|| Average phone not value for money|| nice phone at this price range go for it|| Waste mobile,2.0 out of 5 stars|| 5.0 out of 5 stars|| 4.0 out of 5 stars|| 4.0 out of 5 stars|| 1.0 out of 5 stars|| 5.0 out of 5 stars|| 1.0 out of 5 stars|| 5.0 out of 5 stars|| 5.0 out of 5 stars|| 4.0 out of 5 stars,"['Camera', 'Battery', 'Price']"
187,Tecno Spark 7 Pro (Alps Blue 4GB RAM 64GB Storage),₹34949.00,4.2 out of 5 stars,49080 ratings,In stock.,OPPO,India,Android,8 GB,0.9 x 7.69 x 16.52 cm, 500 Grams,1 Lithium Polymer batteries required. (included),"Front Camera, Dual_Sim, Face Unlock, LED Flash, Camera",Touchscreen Phone,Legendary Track Design,4250,If you love playing games and are looking for a smartphone that can help you enjoy a smooth and responsive gaming experience then say hello to the Realme Narzo 30 Pro 5G smartphone. Boasting a powerful Dimensity 800U 5G processor this smartphone can easily handle any task. You can capture stunning photos wherever you are as this phone comes with a 48 MP triple camera setup. Furthermore its Super Nightscape mode helps you click clear and vivid photos even in low-light conditions.,Camera is like pro|| Highly recommended|| THE WORST|| Received a used product. #shame|| Warranty issues|| Battery is worstno use|| Ok|| Great,1.0 out of 5 stars|| 5.0 out of 5 stars|| 5.0 out of 5 stars|| 1.0 out of 5 stars|| 3.0 out of 5 stars|| 5.0 out of 5 stars|| 5.0 out of 5 stars|| 5.0 out of 5 stars|| 4.0 out of 5 stars|| 1.0 out of 5 stars,"['Camera', 'Battery']"
188,Tecno Spark 7 (Morpheus Blue 2GB RAM 32 GB Storage) - 6000mAh Battery|16 MP Dual Camera| 6.52” Dot Notch Display,₹8999.00,4.1 out of 5 stars,985 ratings,In stock.,Samsung India Electronics Private Limited,India,Android,8 GB,15.6 x 0.9 x 7.5 cm, 900 Grams,1 Lithium Polymer batteries required. (included),"Dolby Atmos support for surround sound, On-Display Fingerprint sensor, Dual messenger support, Samsung Pay (NFC) Enabled, Camera features: Single Take, HDR, Scene optimizer, Night mode, Hyperlapse, Slow motion, Portrait mode, Intelligent Flaw detection",Bar,Obsidiant Black,4060,Packed with a host of features it scores high in terms of functionality. This makes it a must-have.,Amazing design! Best NON CHINESE phone in this range.|| Samsung Galaxy M11 sensor issue and no replacement|| Phone for office use and multitasking but not for photography.|| Feeling cheated|| Buy something else.|| Defect product|| Great Value for MONEY|| Overall a Package|| Upset|| Phone ment for flood n lockdown period due to its excellent battery  voice n camera,1.0 out of 5 stars|| 4.0 out of 5 stars|| 4.0 out of 5 stars|| 1.0 out of 5 stars|| 1.0 out of 5 stars|| 1.0 out of 5 stars|| 1.0 out of 5 stars|| 5.0 out of 5 stars|| 1.0 out of 5 stars|| 5.0 out of 5 stars,"['Camera', 'Battery', 'Design', 'Price']"
189,OPPO Reno5 Pro 5G (Astral Blue 8GB RAM 128GB Storage) with No Cost EMI/Additional Exchange Offers,₹21999.00,4.1 out of 5 stars,588 ratings,In stock.,HMD Global,India,Android 10.0,4 GB,16 x 0.8 x 7.3 cm, 190 Grams,1 Lithium Polymer batteries required. (included),"Rear Camera, Front Camera, Dual_Sim, LED Flash",Touchscreen Phone,Aura Black,5000,"Redmi 9 Power comes with Octa-core Qualcomm snapdragon 662 processor and upto 2.0GHz clock speed. It also comes with 48 MP Quad Rear camera setup + Ultra-wide and Macro mode along with 8 MP front camera. Redmi 9 Power also features 16.58 centimeters 6.53-inch) FHD + display with 1080x2340 pixels and 19.5, 9 aspect ratio. It also comes with 6000 mAh large battery with 18W charging support. Dual speakers",earphones levu. and Mobile software working slow. So Mobile avarage. Amazon|| Oppo a31|| Awesome|| Osm|| Waste of money. Please don't buy it|| Complaint|| Worthy n best product|| No headphone in the box|| Average!|| Very Good product,4.0 out of 5 stars|| 4.0 out of 5 stars|| 5.0 out of 5 stars|| 4.0 out of 5 stars|| 4.0 out of 5 stars|| 5.0 out of 5 stars|| 5.0 out of 5 stars|| 5.0 out of 5 stars|| 5.0 out of 5 stars|| 1.0 out of 5 stars,[]
190,realme C11 (2021) (Cool Grey 2GB RAM 32GB Storage) with No Cost EMI/Additional Exchange Offers,₹21999.00,4.3 out of 5 stars,927 ratings,Out of stock.,Rising Stars Mobile India Private Limited,India,"OneU 3.1, Android 11",8 GB,0.9 x 7.6 x 16.4 cm, 196 Grams,1 Lithium Polymer batteries required. (included),"Dual SIM, GPS, Video Player, Music Player",Bar,Shimmer blue,4000,Infinity display provides truly immersive viewing experience by maximized screen size. It’s ideal for gaming watching videos multi-tasking/browsing and more,Flagship Murderer.. This Is Beast...|| Disappointed with the purchase|| Don't compare Just go with it.|| Nice phone in attractive price|| No fast charging|| Nice phone - worth the price|| No 2nd thought go for it|| In this model: go with 12 gb ram 265 gb storage|| A well balanced phone.|| Not upto the mark,1.0 out of 5 stars|| 5.0 out of 5 stars|| 1.0 out of 5 stars|| 1.0 out of 5 stars|| 5.0 out of 5 stars|| 5.0 out of 5 stars,"['Battery', 'Price']"
191,(Renewed) Vivo X50 Pro (Alpha Grey 8GB RAM 256GB Storage) Without Offer,₹32999.00,4.3 out of 5 stars,2 ratings,In stock.,Sky Cable,India,"OneU 3.1, Android 11",2 GB,16 x 0.8 x 7.5 cm, 198 Grams,1 Lithium ion batteries required. (included),"Front Camera, Camera",Bar,Atlantic Blue,4300,"The Vivo Y72 5G smartphone comes with 48MP+2MP rear camera 8MP front camera Qualcomm® Snapdragon ™ 480 Octa-core processor 8GB RAM 128GB ROM 18W flash charging 16.71 cm (6.58"") with FHD+ Display and refresh rate 90Hz 5000mAh battery (C-Type) and much more.",Just OK|| I lost my 14000rs money after buying M11 4GB RAM phone in just two months e|| Best phone to buy in this price range|| Touchscreen not working in just 10 days. Pathetic after sales service|| Great purchase|| Camera is ok but worth the money|| The worst Amazon|| Amazing phones|| Average product|| Punchhole designed Camara and fast chaging,1.0 out of 5 stars|| 3.0 out of 5 stars|| 4.0 out of 5 stars|| 4.0 out of 5 stars|| 1.0 out of 5 stars|| 3.0 out of 5 stars|| 5.0 out of 5 stars|| 4.0 out of 5 stars|| 4.0 out of 5 stars|| 5.0 out of 5 stars,"['Camera', 'Price']"
192,OnePlus 9 5G (Astral Black 8GB RAM 128GB Storage),₹7499.00,4.2 out of 5 stars,67307 ratings,In stock on August 26 2021.,Xiaomi,India,Android,4 GB,17.78 x 7.62 x 6.35 cm, 180 Grams,1 Lithium Polymer batteries required. (included),"33W Fast Charger in box, 54% in 30 mins, The display is protected by Corning Gorilla Glass 3, 64 MP AI Quad Camera Setup 8MP Ultrawide-FOV 118 degrees 2 MP Macro Sensor 2 MP Depth Sensor Slow Motion Support - Up to 960 fps Portrait | Panaroma | Time Lapse | Pro Mode | Night Mode | Short Video Mode | Ultra wide-angle distortion correction | Custom Watermark | Document mode | HDR | AI scene detection | Video macro mode | Movie frame | Time burst | Google Lens| AI Watermark, Dual Stereo Speakers for immersive audio experience. Hi-Res certified audio, 3.5mm Jack, IR Blaster, Dedicated Micro SD Slot, Z-Axis Linear Vibration Motor",Bar,Prism Black,5000,"The Vivo Y20G smartphone comes with 13MP+2MP+2MP triple rear camera 8MP Selfie Camera MediaTek Helio G80 octa core processor 6GB RAM 128GB internal memory expandable up to 1 TB 16.55 cm (6.51"") FullView Display a massive 5000mAh battery (C Type) with 18W fast charging.",Nice phone|| This phone lags too much|| Good in Midrange Phones,4.0 out of 5 stars|| 5.0 out of 5 stars|| 4.0 out of 5 stars|| 5.0 out of 5 stars|| 5.0 out of 5 stars|| 5.0 out of 5 stars|| 4.0 out of 5 stars|| 5.0 out of 5 stars|| 1.0 out of 5 stars|| 5.0 out of 5 stars,[]
193,Mi 10 (Coral Green 8GB RAM 128GB Storage) - 108MP Quad Camera SD 865 Processor 5G Ready,₹31929.00,4.2 out of 5 stars,2 ratings,In stock.,Redmi,India,Android 8.1,8 GB,16.5 x 0.9 x 7.7 cm, 193 Grams,1 Lithium Polymer batteries required. (included),"RGB Light sensor, Dual SIM, Fingerprint sensor, E-mail, Hall sensor, GPS, Video PlayerAccelerometer, Virtual Proximity Sensing, Gyro sensor, Geomagnetic sensor, Music Player",Touchscreen Phone,Onyx Black,2400,The iQOO 7 smartphone comes with Qualcomm Snapdragon 870 5G Mobile Platform Intelligent Display Chip with Enhanced Frame Rate & All HDR 48MP OIS Main camera with Sony IMX598 sensor 2GB RAM & 256GB Storage 66W FlashCharge 16.82cm (6.62) 120Hz AMOLED Display with 1300 peak brightness along with 300Hz Touch Sampling Rate 6000mm² Graphite Layer Full Coverage Liquid Cooling Technology Extended RAM and much more.,Check cost|| Worst Galaxy Phone,4.0 out of 5 stars|| 3.0 out of 5 stars|| 1.0 out of 5 stars|| 1.0 out of 5 stars|| 1.0 out of 5 stars|| 4.0 out of 5 stars|| 1.0 out of 5 stars|| 1.0 out of 5 stars|| 5.0 out of 5 stars|| 1.0 out of 5 stars,['Price']
194,Tecno Spark 7 (Spruce Green 2GB RAM 32 GB Storage) - 6000mAh Battery|16 MP Dual Camera| 6.52” Dot Notch Display,₹34990.00,4.3 out of 5 stars,25 ratings,Out of stock.,Vivo,India,"Android 11, Funtouch OS 11.1",8 GB,15.5 x 7.5 x 0.8 cm, 185 Grams,1 Lithium Polymer batteries required. (included),"Rear Camera, Front Camera, USB, Dual_Sim",Touchscreen Phone,Frost White,4500,iQOO Z3 is a Fully Loaded smartphone equipped with India's First Qualcomm Snapdragon 768G 5G Mobile Platform 55W FlashCharge Technology 64MP Main Camera with features like 4K videos @ 60FPS & EFB Autofocus Tracking 120Hz Refresh Rate Five-Layer Liquid Cooling System Extended RAM Technology which can extend a part of the memory to be used as an extra RAM & much more.,It heats too much.|| Disgusting mobile|| Good,1.0 out of 5 stars|| 1.0 out of 5 stars,[]
195,Redmi 9 Power (Mighty Black 4GB RAM 64GB Storage) - 6000mAh Battery |FHD+ Screen | 48MP Quad Camera | Alexa Hands-Free Capable,₹20990.00,4.3 out of 5 stars,66356 ratings,In stock.,OPPO,India,Android 11,8 GB,16 x 7.3 x 0.8 cm, 199 Grams,1 Lithium Polymer batteries required. (included),"Rear Camera, Front Camera, USB, Dual_Sim, Fast Charging",Touch,Midnight Black,4510,Galaxy M32  the new #BingeMonster comes with a segment best FHD+ SuperAMOLED 90Hz display with 800 Nits High Brightness mode for a bright clear and smooth viewing experience be it while watching your favorite movies scrolling on social media or gaming. It also sports a segment best 6000 mAh battery and a versatile 64MP Quad camera. Galaxy M32 comes with the latest OneUI 3.1 on Android 11 out of the box packed with defence grade Knox security and AltZ Life for privacy.,Gajab design|| Nice|| My previous review was in good hope as per the features shared and first few scrolls.|| Indian Boy|| Superb phone|| Made in India|| Worth the price. Great mobile.|| Avg phone. Buy it if you are not gamer|| Nice Made in India Phone.|| Good battery and unlagged experience,5.0 out of 5 stars|| 3.0 out of 5 stars|| 5.0 out of 5 stars|| 5.0 out of 5 stars|| 3.0 out of 5 stars|| 1.0 out of 5 stars|| 5.0 out of 5 stars|| 4.0 out of 5 stars|| 1.0 out of 5 stars|| 1.0 out of 5 stars,"['Battery', 'Design', 'Price']"
196,(Renewed) Samsung Galaxy S10 Lite (Prism White 8GB RAM 128GB Storage),₹25000.00,3.6 out of 5 stars,27 ratings,In stock.,Samsung,India,Android,8 GB,16 x 7.3 x 0.8 cm, 199 Grams,1 Lithium ion batteries required. (included),"Dual SIM, Video Player, Music Player",Bar,Fantasy White,4000,Galaxy A22  the new awesome A series device comes with a 48MP OIS (Optical Image stabilisation) Quad Camera that provides sharp and steady pictures and videos evertime you shoot segment best HD+ SuperAMOLED 90Hz display with 600 Nits High Brightness mode for a bright clear and smooth viewing experience be it while watching your favorite movies scrolling on social media or gaming. It also sports a long lasting 5000 mAh battery with fast charging. Galaxy A22 comes with the latest OneUI 3.1 on Android 11 out of the box packed with defence grade Knox security and Samsung Pay (NFC) for simple secure payments right from your phone.,Good 👍👍👍👍👍👍👍|| Spark 7 Pro- Top quality Camera and Screen|| Tecno Spark 7 Pro (Magnet Black 6GB RAM 64GB Storage) Worth of Price truly Made in India for India|| Fake features|| UNDERRATED HIDDEN GEM|| Loved it|| Faulty Defective Product Techno spark|| Best value for money Suggesting everyone to buy|| Best camera at this price point|| Good budget phone but beware of fake promotional offers,4.0 out of 5 stars,"['Camera', 'Screen', 'Price', 'Build Quality']"
197,Samsung Galaxy M42 5G (Prism Dot Black 6GB RAM 128GB Storage) 6 Months Free Screen Replacement for Prime,₹39999.00,4.3 out of 5 stars,2334 ratings,In stock.,OnePlus,India,"Android 11, Funtouch OS 11.1",12 GB,16.9 x 0.9 x 7.6 cm, 193 Grams,1 Lithium ion batteries required. (included),Memoria ampliablemicro SD 1 TB ProcesadorOcta Core ProcesadorQualcomm Snapdragon 855 (1x2.8Ghz + 3x2.4Ghz + 4x 1.7 Ghz) Sistema OperativoAndroid Versión S.O.10,Bar,Glacial Green,4510,it2161 Ace comes with a 4.5cm (1.8) 1000mAh Battery Bright Display  Vibration Mode Support BT Caller 08 Input Language  WFM Auto Call Recorder,Don't buy this phone|| One of the good choice for low budget phone|| Simply excellent. Read complete review written after my 30 days of experience|| Amezing One|| Value-For-Money & Recommended for a normal user|| Poor|| Dont buy it as lower model is good then this|| BUDGET WORTHY PHONE|| Poor processor basic UI also lagging|| Compass is not working,5.0 out of 5 stars|| 5.0 out of 5 stars|| 5.0 out of 5 stars|| 4.0 out of 5 stars|| 5.0 out of 5 stars|| 1.0 out of 5 stars|| 1.0 out of 5 stars|| 5.0 out of 5 stars|| 3.0 out of 5 stars|| 5.0 out of 5 stars,"['Performance', 'Price']"
198,LG V40 ThinQ (Grey 6GB RAM 128GB Storage),₹37990.00,4.1 out of 5 stars,871 ratings,In stock.,Samsung,India,Android,12 GB,16.1 x 0.9 x 7.7 cm, 176 Grams,1 A batteries required. (included),Camera : Rear camera and front camera available,Bar,Mirage Black,4000,The iQOO 7 smartphone comes with Qualcomm Snapdragon 870 5G Mobile Platform Intelligent Display Chip with Enhanced Frame Rate & All HDR 48MP OIS Main camera with Sony IMX598 sensor 8GB RAM & 128GB Storage 66W FlashCharge 16.82cm (6.62) 120Hz AMOLED Display with 1300 peak brightness along with 300Hz Touch Sampling Rate 6000mm² Graphite Layer Full Coverage Liquid Cooling Technology Extended RAM and much more.,Oscem|| redmi 9 prime|| Best in class @9999|| 🤔prime.. prime🤭🤭🤭ᴄʰᵃⁿᵍᵉᵈ🙄🙄|| value for money|| No to Redmi|| Good|| Not a Great Phone at 12000|| Binod.|| One & Only of year 2020 the Best Budget Phone under 10K!,1.0 out of 5 stars|| 5.0 out of 5 stars|| 5.0 out of 5 stars|| 5.0 out of 5 stars|| 1.0 out of 5 stars|| 1.0 out of 5 stars|| 5.0 out of 5 stars|| 5.0 out of 5 stars|| 1.0 out of 5 stars|| 5.0 out of 5 stars,['Price']
199,Oppo A54 (Crystal Black 4GB RAM 128GB Storage) with No Cost EMI/Additional Exchange Offers,₹39999.00,4.3 out of 5 stars,65796 ratings,In stock.,Samsung India pvt Ltd,India,Android 8.1,3 GB,16.3 x 7.6 x 0.85 cm, 186 Grams,1 Lithium ion batteries required. (included),"Dual SIM, Infrared, E-mail, Accelerometer, Ambient light sensor, Gyroscope, GPS, Video Player, Music Player, Proximity sensor",Bar,Blue,4820,Redmi 9 Prime comes with Octa-core Helio G80 processor and upto 2.0GHz clock speed. It also comes with 13 MP Quad Rear camera setup + Ultra-wide and Macro mode along with 8 MP front camera. Redmi 9 Prime also features 16.58 centimeters (6.53-inch) FHD + display with 1080x2340 pixels and 19.5:9 aspect ratio. It also comes with 5020 mAH large battery with 18W charging support.,Awesome product thanxx amazon|| Q|| Spark 7 mobile|| Value for money in 10k budget|| Recommend for screen and battery|| Love the camera. Great product at 7500/-|| Great in this range|| A very satisfying experience with the device so far. Purchased the phone 3 weeks back.|| More quantity with lesser quality.|| Great value for money with good design,5.0 out of 5 stars|| 5.0 out of 5 stars|| 5.0 out of 5 stars|| 1.0 out of 5 stars|| 5.0 out of 5 stars|| 1.0 out of 5 stars|| 1.0 out of 5 stars|| 4.0 out of 5 stars|| 4.0 out of 5 stars|| 4.0 out of 5 stars,"['Camera', 'Battery', 'Design', 'Screen', 'Price', 'Build Quality']"
