,title,price,rating,total_reviews,availability_status,manufacturer,country_of_origin,os,ram,product_dimensions,weight,batteries,special_features,form_factor,colour,battery_power_rating,product_description,reviews,reviews_rating,Category
129,(Renewed) OnePlus 8 (Glacial Green 8GB RAM+128GB Storage),₹11499.00,3.0 out of 5 stars,88 ratings,In stock.,G Mobiles,India,Android,8 GB,16.37 x 0.78 x 7.64 cm, 186 Grams,1 A batteries required. (included),"4500mAH lithium-ion battery (non-removable), Main camera features: Clear, high-resolution photos, Nightscape, Automated AI Photo Enhancer, Portrait mode, and filters., In-display fingerprint sensor., Front camera features - Face Unlock, HDR, Screen Flash, face retouching, and filters., Thickness: 7.9mm, slimmest OnePlus phone since the OnePlus 6T. Weight: 170g",Touchscreen Phone,Laser Black,6000,The iQOO 7 smartphone comes with Qualcomm Snapdragon 870 5G Mobile Platform Intelligent Display Chip with Enhanced Frame Rate & All HDR 48MP OIS Main camera with Sony IMX598 sensor 8GB RAM & 256GB Storage 66W FlashCharge 16.82cm (6.62) 120Hz AMOLED Display with 1300 peak brightness along with 300Hz Touch Sampling Rate 6000mm² Graphite Layer Full Coverage Liquid Cooling Technology Extended RAM and much more.,Best phone ❤️❤️|| Worth less|| Decent one !!! Amazing|| Nice build externally looks elegant|| Worst Buy|| Not Worth For Money|| Photo lovers should be buy|| Very Good phone with Superb camera and fast Charging|| Awesome phone...|| Premium Flagship,2.0 out of 5 stars|| 3.0 out of 5 stars|| 1.0 out of 5 stars|| 1.0 out of 5 stars|| 1.0 out of 5 stars|| 1.0 out of 5 stars|| 1.0 out of 5 stars|| 5.0 out of 5 stars|| 5.0 out of 5 stars|| 4.0 out of 5 stars,"['Camera', 'Battery', 'Design', 'Build Quality']"
130,MI 10T Pro 5G (Lunar Silver 8GB RAM 128GB Storage) -|Alexa Hands-Free Capable | Additional Exchange/No Cost EMI Offers,₹32990.00,5.0 out of 5 stars,1086 ratings,Only 1 left in stock.,Vivo Mobile India Pvt Ltd,China,Android 11,8 GB,16.5 x 7.6 x 0.9 cm, 169 Grams,1 Lithium ion batteries required. (included),"Dual SIM, E-mail, Accelerometer, GPS, Ambient Light sensor, Video Player, Music Player, Proximity sensor",Bar,Blazing Blue,5000,"Colour: Midnight Black | Size name:128 GB Mi 10i has a 108MP Quad camera setup that brings the highest resolution camera lens on smartphones to capture exceptional photos even in difficult lighting conditions. The 16.9cm (6.67"") large display comes with up to 120Hz AdaptiveSync display. Qualcomm Snapdragon 750G octa-core fast processor with 8nm technology makes you future-ready with support for 5G networks. Coupled with MIUI 12 system level optimizations enables lower power consumption for a longer battery life on the 4820mAh battery that also comes with 33W Fast charger (in the box) whenever you need it. The multimedia experience is a notch above with the stereo speakers on your Mi 10i. Note:Incase of any issue with the product kindly contact brand at 1800 103 6286 between Service hours: 09:00-21:00.",Good,5.0 out of 5 stars|| 4.0 out of 5 stars|| 4.0 out of 5 stars|| 5.0 out of 5 stars|| 4.0 out of 5 stars|| 5.0 out of 5 stars,[]
131,Vivo Y73 (Roman Black 8GB RAM 128GB Storage) with No Cost EMI/Additional Exchange Offers,₹32990.00,4.1 out of 5 stars,8367 ratings,In stock.,Xiaomi,India,Funtouch OS 11.1 (Based on Android 11),6 GB,16.3 x 7.6 x 0.85 cm, 209 Grams,1 Lithium ion batteries required. (included),"Dual SIM, GPS, Video Player, Music Player",Touchscreen Phone,Tuscany Coral,5000,"Presenting Tecno Spark Go 2021 a perfect smartphone with bolder and refreshed looks and with superior specs yet affordable on your pocket. It has a massive 5000mAh battery with 36 days long standby for non-stop action. You get a big 6.52"" HD+ display to enjoy movies and games on a bigger screen. Spark Go 2021 comes with 13MP AI Dual rear camera with f1.8 large aperture and 8MP AI selfie camera with front flash to capture clear and vivid images. Its unique audio share feature helps you enjoy music and movies together with your friends and family. For security you get smart fingerprint sensor and face unlock features",Dont buy this|| ## OVERALL PERFECT PHONE 📱📱|| I am loving it!!|| A useless review|| Costly but waste of money phone|| Just Ok for normal uses|| Worth of money|| Quality Camera last longing battery good screen resolution|| It's a crap with lot of unnecessary junk applications|| Very very bad experience hard earn money loss,4.0 out of 5 stars|| 5.0 out of 5 stars|| 3.0 out of 5 stars|| 1.0 out of 5 stars|| 1.0 out of 5 stars|| 5.0 out of 5 stars|| 5.0 out of 5 stars|| 1.0 out of 5 stars|| 1.0 out of 5 stars|| 5.0 out of 5 stars,"['Camera', 'Battery', 'Screen', 'Build Quality']"
132,Samsung Galaxy M32 (Black 6GB RAM 128GB Storage) 6 Months Free Screen Replacement for Prime,₹32290.00,4.2 out of 5 stars,49080 ratings,In stock.,Samsung,India,Android,6 GB,17.9 x 9.3 x 6.3 cm, 203 Grams,1 Lithium ion batteries required. (included),Dual SIM,Bar,Blue,2500,The Vivo X50 smartphone comes with 48MP+13MP+8MP+5MP rear camera 32MP front camera Qualcomm Snapdragon 730 octa core processor 8GB RAM 128GB internal memory 16.66 cm (6.56) FHD+ S-Amoled Ultra O Display a massive 4200mAh battery along with 33W fast charging and much more.,Don't buy waste of money|| Exceeded expectations!!|| V20 Pro..UI Battery camera and price.|| Battery is 4100mha but it's like 2800|| Worst phone in this price|| Worst vivo phone ever|| Nice phone and camera phone|| Good Phone but average battery life|| Too expensive for dimensity 700|| Good product recommend others to go for it.,1.0 out of 5 stars|| 5.0 out of 5 stars|| 5.0 out of 5 stars|| 1.0 out of 5 stars|| 2.0 out of 5 stars|| 1.0 out of 5 stars|| 1.0 out of 5 stars|| 1.0 out of 5 stars|| 1.0 out of 5 stars|| 1.0 out of 5 stars,"['Camera', 'Battery', 'Price']"
133,Samsung Galaxy M51 (Electric Blue 6GB RAM 128GB Storage) 6 Months Free Screen Replacement for Prime,₹27999.00,4.3 out of 5 stars,79 ratings,In stock.,OnePlus,India,Android 11,12 GB,16 x 7.5 x 0.7 cm, 185.5 Grams,1 Lithium Polymer batteries required. (included),"Fingerprint, Dual SIM, E-compass, Accelerometer, Gyroscope, GPS, Ambient Light sensor, Video Player, Music Player, Proximity sensor",Bar,Starry Black,4000,4 Gb ram 128 gb rom expandable upto 128 gb 5.5 Inch full hd display 13mp + 13mp dual rear camera 13mp front camera 3200 mah battery qualcomm snapdragon 652 processor,Needs improvement|| Best Alternative of Chinese Phone|| Poor signal reception(both wifi & mobile signal)|| Poor after buy service|| Quality should be improved|| MOST Recommend for Elders least recommended for high expectations on Camera|| Quality is not as per nokia’s brand image|| Amazing Value For Money|| Best Phone at this price point|| Very poor service of Amazon and Seller,5.0 out of 5 stars|| 5.0 out of 5 stars|| 1.0 out of 5 stars|| 1.0 out of 5 stars|| 1.0 out of 5 stars|| 4.0 out of 5 stars|| 1.0 out of 5 stars|| 1.0 out of 5 stars|| 4.0 out of 5 stars|| 1.0 out of 5 stars,"['Camera', 'Price', 'Build Quality']"
134,Mi 11X 5G Celestial Silver 6GB RAM 128GB ROM | SD 870 | DisplayMate A+ rated E4 AMOLED|Upto 4000 Additional Exchange,₹16999.00,3.5 out of 5 stars,490 ratings,In stock.,Redmi,India,Android 11.0,4 GB,16.5 x 7.6 x 0.9 cm, 199 Grams,1 Lithium ion batteries required. (included),"Dimensions: 16.95x 0.95x7.63 - Other display features: 20:9 aspect ratio, Corning Gorilla Glass 3 - Other Camera Features: Single Take (Rear and Front), Camera, Single Take (Rear and Front) Dimensions: 16.95x 0.95x7.63 - Other display features: 20:9 aspect ratio, Corning Gorilla Glass 3",Touchscreen Phone,Cosmic Black,5000,The Maplin Map4 mobile which has a real Big Size 6.53 waterdrop Full Body display touch screen display with a resolution of 1080 pixels by 1920 pixels. The Maplin Map 4 Series 5G is powered by 1.3 GHz Quad core Snapdragon processor and it comes with 4 GB of RAM. The phone packs 64 GB of internal storage that can be expanded upto 128 GB. As far as the cameras are concerned the Maplin packs a 13 Megapixel Triple rear camera on the rear 13 MP Front Camera for selfies. The Maplin Map4 5G runs Android 8.1 Oreo and is powered by a 5000mAh non-removable battery. It measures 154mmx76mmx8.2mm and weight 142.00 grams. The Maplin Map4 Series is a dual SIM (GSM and GSM) with SD card smartphone that accepts Micro-SIM and Micro-SIM. Connectivity options include Wi-Fi GPS Bluetooth NFC USB OTG FM 3G and 4G. Sensors on the phone include Compass Magnetometer Finger Print Sensor Proximity sensor Accelerometer Ambient light sensor.,Excellent mobile with poor battery|| Pixel 3XL|| Pure clean and allways updated,5.0 out of 5 stars|| 1.0 out of 5 stars|| 4.0 out of 5 stars|| 5.0 out of 5 stars|| 1.0 out of 5 stars|| 1.0 out of 5 stars|| 4.0 out of 5 stars|| 3.0 out of 5 stars|| 4.0 out of 5 stars|| 5.0 out of 5 stars,['Battery']
135,Vivo X60 (Midnight Black 12GB RAM 256GB Storage) | Upto 12 Months No Cost EMI | Extra 3500 Off on Exchange,₹16999.00,3.4 out of 5 stars,21077 ratings,Out of stock.,Vivo Mobile India Pvt Ltd,India,Android,4 GB,16.1 x 0.9 x 7.6 cm, 161 Grams,1 Lithium Polymer batteries required. (included),"Dual SIM, In-display fingerprint sensor, E-mail, Electronic compass, Accelerometer, Ambient light sensor, Gyroscope, Sensor core, Serial_number, GPS, Proximity sensor",Touchscreen Phone,Cosmic Black,5000,The product comes in a very proper packaging. This product will be an excellent pick for you.,Not satisfied|| Good|| Battery's are reduced quickly|| Battery dead|| One plus8t|| Bettery power fast discharge|| Don't buy it,1.0 out of 5 stars|| 1.0 out of 5 stars|| 5.0 out of 5 stars|| 5.0 out of 5 stars|| 5.0 out of 5 stars|| 4.0 out of 5 stars|| 5.0 out of 5 stars|| 5.0 out of 5 stars|| 4.0 out of 5 stars|| 3.0 out of 5 stars,['Battery']
136,(Renewed) Samsung Galaxy S20 FE 5G (Cloud Navy 8GB RAM 128GB Storage),₹18499.00,4.0 out of 5 stars,388 ratings,Out of stock.,Xiaomi,India,Stock Android 10,8 GB,16.5 x 7.6 x 1 cm, 186 Grams,1 Lithium ion batteries required. (included),"Touchscreen, Front Camera, Dual_Sim, Camera, Fast Charging",Smartphone,Rose Pink,4500,This is Nokia (Renewed) C3 Android 10 Smartphone with 2GB RAM 16GB Storage All-Day Battery and Fingerprint Sensor. Available in Colour: Nordic Blue.,Not user friendly.|| Excellent mobile from oppo|| Nice phone for business persons|| Substandard Battery and poor Touch Request Replace as promised|| Bad phone !!!|| Value for money|| Bad choice|| Worst camera quality|| Oppo F19 pro|| Big hang problem,4.0 out of 5 stars|| 1.0 out of 5 stars|| 4.0 out of 5 stars|| 5.0 out of 5 stars|| 4.0 out of 5 stars|| 4.0 out of 5 stars|| 4.0 out of 5 stars|| 4.0 out of 5 stars|| 5.0 out of 5 stars|| 4.0 out of 5 stars,"['Camera', 'Battery', 'Price', 'Build Quality']"
137,Gionee F8 Neo (Red) 2GB Ram 32GB ROM Face UnlockSmart Gestures Full View Display,₹49999.00,3.5 out of 5 stars,708 ratings,In stock.,Karbonn,India,Android,4 GB,0.8 x 7.4 x 15.9 cm, 214 Grams,1 Lithium Polymer batteries required. (included),"Audio Share, Dark Theme, Social Turbo, Fingerprint Sensor, big battery, 480nits brightness, Dual SIM+SD Card Slot (Expandable up to 256GB), Dual Camera",Bar,Black,4300,Introducing Pixel 3a It has an extraordinary camera with features such as Night Sight Super Res Zoom Portrait Mode and HDR+. It features a battery that charges fast and lasts all day long. It also comes with three years of security and OS updates included. It’s everything you love about Google – in a phone,Bakwas phone|| After replacement..now better|| Good overall|| Worst phone in this segment|| Smooth user experience|| the best 🤞|| Best under 25k range|| Great phone|| Buy if software performance matters most to you.|| Great product and good good service by amazon,5.0 out of 5 stars|| 5.0 out of 5 stars|| 1.0 out of 5 stars|| 2.0 out of 5 stars|| 5.0 out of 5 stars|| 3.0 out of 5 stars|| 1.0 out of 5 stars|| 1.0 out of 5 stars|| 2.0 out of 5 stars|| 5.0 out of 5 stars,['Performance']
138,Mi 10i 5G (Atlantic Blue 8GB RAM 128GB Storage)- 108MP Quad Camera | Snapdragon 750G Processor | Upto 2000 Additional Exchange,₹23999.00,4.0 out of 5 stars,4133 ratings,Out of stock.,Micromax,India,Android,64 GB,16.5 x 7.6 x 0.9 cm, 210 Grams,1 Lithium Polymer batteries required. (included),"Dual SIM, GPS, Music Player, Video Player, Accelerometer, Fingerprint Sensor, Gyro Sensor, Geomagnetic Sensor, Proximity Sensor, E-mail",Bar,Laser Blue,5000,If you love playing games and are looking for a smartphone that can help you enjoy a smooth and responsive gaming experience then say hello to the Realme Narzo 30 Pro 5G smartphone. Boasting a powerful Dimensity 800U 5G processor this smartphone can easily handle any task. You can capture stunning photos wherever you are as this phone comes with a 48 MP triple camera setup. Furthermore its Super Nightscape mode helps you click clear and vivid photos even in low-light conditions.,Bakwas phone|| After replacement..now better|| Good overall|| Worst phone in this segment|| Smooth user experience|| the best 🤞|| Best under 25k range|| Great phone|| Buy if software performance matters most to you.|| Great product and good good service by amazon,1.0 out of 5 stars|| 1.0 out of 5 stars|| 4.0 out of 5 stars|| 4.0 out of 5 stars|| 5.0 out of 5 stars|| 3.0 out of 5 stars|| 5.0 out of 5 stars|| 3.0 out of 5 stars|| 1.0 out of 5 stars|| 5.0 out of 5 stars,['Performance']
139,Samsung Galaxy S10 Lite (Prism Black 8GB RAM 128GB),₹12490.00,4.3 out of 5 stars,52867 ratings,Out of stock.,Samsung India Electronics Private Limited,India,Android,8 GB,0.8 x 7.4 x 15.9 cm, 730 Grams,1 Lithium Polymer batteries required. (included),"Front Camera, Expandable_Memory",Touchscreen-Handy,Magnet Black,3000,Introducing Tecno Spark 7 a perfect smartphone with superior specs yet affordable on your pocket. It has a massive 6000mAh battery with up to 40 days long standby for non-stop action. You get a big 6.52 HD+ display to enjoy movies and games on a bigger screen. Spark 7 comes with 16MP AI Dual rear camera with f/1.8 large aperture and Quad flash and 8MP AI selfie camera with Dual front flash to capture clear and vivid images. Its has unique camera and entertaiment features like Time LapseVideo BokehSlow Motion and Audio Share . For security you get smart fingerprint sensor and face unlock features. Have fun with this budget Hero,Pray you don't receive a defective product|| Best phone|| Bad|| Must to have redmi phone|| Redmi is the 👍💯|| Worst phone with ghost touch|| Before buying you must know the difference between 7k mobile and 10k to 15K Mobiles|| Not recommended.|| Best budget smartphone|| Little bit overheated,4.0 out of 5 stars|| 3.0 out of 5 stars|| 5.0 out of 5 stars|| 5.0 out of 5 stars|| 3.0 out of 5 stars|| 5.0 out of 5 stars|| 1.0 out of 5 stars|| 5.0 out of 5 stars,[]
140,Tecno Spark 7 (Magnet Black 2GB RAM 32 GB Storage) - 6000mAh Battery|16 MP Dual Camera| 6.52” Dot Notch Display,₹35999.00,4.3 out of 5 stars,46 ratings,In stock.,G Mobiles,India,Android 6.0,4 GB,16 x 0.8 x 7.3 cm, 180 Grams,1 Lithium ion batteries required. (included),"Front Camera, Camera",Touchscreen Phone,Gray,4500,Colour: Vintage Bronze | Size name:128 GB 120Hz high refresh rate FHD+ 1080x2400) 6.67 inch large AMOLED Dot display with 20:9 aspect ratio and HDR 10 support ensures smooth and superior multimedia viewing experience . Qualcomm Snapdragon 732G octa-core processor with 8nm process technology coupled with latest MIUI 12 Based On Android 11) enables low power consumption for a longer battery life and immersive user experience as well as great performance. Flagship 108MP Quad camera setup facilitates user to capture high resolution photographs with greater detail in almost all lighting conditions as well as scenarios. Comes with support for Ultra wide Macro and Portrait with several modes in the camera app which enhances the photography experience. Massive 5020 mAh battery bundled with 33W fast charger in-box boosts the charging speed as well as provides great battery backup Note:Incase of any issue with the product kindly contact brand at 1800 103 6286 between Service hours: 09:00-21:00.,Some extra to know|| Flagship killer|| Best in Market|| Pleae Read before U purchase|| Wrost phone in this price|| Not matching the hype. Amazon removed my earlier comment|| If your purpose is gaming then go iqoo or else mi 11x is better value for money|| Only hipe. Nothing New.|| All rounder under 30K|| Poor battery performance,5.0 out of 5 stars|| 5.0 out of 5 stars|| 5.0 out of 5 stars,"['Battery', 'Performance', 'Price']"
141,OnePlus 8T 5G (Lunar Silver 8GB RAM 128GB Storage),₹36990.00,4.1 out of 5 stars,85525 ratings,In stock.,Samsung,India,Android,4 GB,16.2 x 7.6 x 0.9 cm, 198 Grams,1 Lithium Polymer batteries required. (included),"Dual SIM, Infrared, Accelerometer, Ambient light sensor, Gyroscope, GPS, Video Player, Music Player, Proximity sensor",Bar,Sunset Melody,6000,OnePlus 8 Pro in green colour. Features a 17.2212 centimeters (6.78-inch) 120Hz fluid display with 3168 x 1440 pixels resolution 513 ppi pixel density vibrant color effect color support.,Peerless camera superb design|| Loved it!|| If you're looking for a good android phone  it's Google pixel !!|| glad i got this|| Delivery asap product has display issues|| Please don't buy this phone from Global Trader Store|| PIXEL 4A|| Finally into Pixel|| Good phone must’ve|| Pixel 4a,1.0 out of 5 stars|| 1.0 out of 5 stars|| 2.0 out of 5 stars|| 3.0 out of 5 stars|| 5.0 out of 5 stars|| 3.0 out of 5 stars|| 5.0 out of 5 stars|| 4.0 out of 5 stars|| 1.0 out of 5 stars|| 4.0 out of 5 stars,"['Camera', 'Design', 'Screen']"
142,(Renewed) OnePlus 8T 5G (Aquamarine Green 12GB RAM 256GB Storage),₹21217.00,3.9 out of 5 stars,769 ratings,In stock.,OPPO Mobiles India Pvt Ltd,India,Android,12 GB,15.9 x 0.7 x 7.4 cm, 157 Grams,1 Lithium Polymer batteries required. (included),Dual SIM,Bar,Sky White,4820,The realme X7 Max features a stylish design and innovative features so that you can enjoy all that the phone has to offer. It is equipped with the 50 W SuperDart Charge feature so that your phone can be quickly charged from 0 to 50% in up to 16 minutes. Thanks to the Android 11 feature you can enjoy the Realme UI 2.0 feature so that you can enjoy easy customization upgraded connectivity and more.,Excellent camera and display|| Good budget phone|| Excellent product|| some feature is missing|| THINK TWICE BEFORE YOU BUY !!|| Worth the money!|| Best for school work|| fantastic software|| Title: Ultra Power Saving mode|| Realme c11 2021,2.0 out of 5 stars|| 3.0 out of 5 stars|| 1.0 out of 5 stars|| 1.0 out of 5 stars|| 1.0 out of 5 stars|| 1.0 out of 5 stars|| 1.0 out of 5 stars|| 5.0 out of 5 stars|| 5.0 out of 5 stars|| 4.0 out of 5 stars,"['Camera', 'Battery', 'Screen']"
143,MI 10T 5G Lunar Silver 8GB RAM 128GB Storage - | Alexa Hands-Free Capable |Additional Exchange/No Cost EMI Offers,₹24999.00,3.1 out of 5 stars,327 ratings,In stock.,Samsung India pvt Ltd,India,Android 10.0,2 GB,16.4 x 0.8 x 7.6 cm, 218 Grams,1 Lithium ion batteries required. (included),"Fast Charging Support, Dual SIM, Fingerprint Sensor, Smartphone",Bar,Grey,4300,Spark 7 Pro offers you a superior experience in every aspect. Its 48MP AI camera with super night mode ensures superior photography and videography experience whereas 6.6 inch dot-in display with 90Hz refresh rate offers bigger and smoother touch experience while browsing or watching videos. Powerful Helio G80 Octa-Core processor along with bigger memory (Upto 6GB) and 180Hz touch sampling rate enhances the gaming experience many folds. That's not it the bigger 5000mAh battery helps you keep going for the whole day without stopping,Worst ever phone by samsung|| not expected|| Nice phone|| About phone|| Excellent phone! Great battery life!|| Headphones is not available in phone box|| Best for normal users|| High price|| Don't waste your money on this phone|| Awesome product.,5.0 out of 5 stars|| 5.0 out of 5 stars|| 1.0 out of 5 stars|| 2.0 out of 5 stars|| 5.0 out of 5 stars|| 3.0 out of 5 stars|| 1.0 out of 5 stars|| 1.0 out of 5 stars|| 2.0 out of 5 stars|| 5.0 out of 5 stars,"['Battery', 'Price']"
144,Vivo Y20i (Dawn White 3GB RAM 64GB Storage) with No Cost EMI/Additional Exchange Offers,₹35990.00,3.7 out of 5 stars,3814 ratings,In stock.,Samsung,India,Funtouch OS 10.5 based on Android 10,8 GB,16.3 x 7.6 x 0.85 cm, 141 Grams,1 Lithium ion batteries required. (included),"Dual SIM, E-mail, Accelerometer, Virtual Light Sensing, GPS, Video Player, Music Player, Proximity sensor",Bar,Midnight Black,4200,"The Vivo Y51A smartphone comes with 48MP+8MP+2MP AI triple rear camera 16MP Selfie Camera Qualcomm Snapdragon 662 octa core processor 8GB RAM 128GB internal memory expandable up to 1 TB 16.58 cm (6.58"") Halo FullView Display a massive 5000mAh battery with 18W (C Type) fast charging.",USB cable  and Earphone missing in box|| Help me|| Poor battery phone is good but at this price doesn't worth|| Device has heating issue|| regression n lockdown worst phone|| I will get cheap prize...also good product|| Nice phone|| No network.. still in service centre .. not getting the solution . No network from purchase date|| Woste product|| Nice phone No issue so far,1.0 out of 5 stars|| 4.0 out of 5 stars|| 5.0 out of 5 stars|| 4.0 out of 5 stars|| 1.0 out of 5 stars|| 1.0 out of 5 stars,"['Battery', 'Price']"
145,OPPO Reno3 Pro (Midnight Black 8GB RAM 256GB Storage) Without Offer,₹15990.00,4.1 out of 5 stars,1646 ratings,In stock.,Samsung India Private Limited,India,Android,4 GB,18 x 9.2 x 6.1 cm, 196 Grams,1 Lithium Polymer batteries required. (included),"Dual SIM, GPS, Video Player, Music Player",Bar,Lunar Silver,4500,Packed with a host of features it scores high in terms of functionality. This makes it a must-have.,Good for parents with moderate usage of device.|| Worst mobile|| so far so good|| NOKIA connecting people this brand is nostalgia|| Seal broken but phone is good|| FAR BETTER THAN REALME REDMI. BEST STOCK ANDROID PHONE|| Decent buy. A nice Android phone with no bloatware|| Bloat-free Stock Experience!|| Device is brilliant for it's price range|| Decent phone,4.0 out of 5 stars,['Price']
146,Redmi Note 9 Pro (Glacier White 4GB RAM 64GB Storage) - Latest 8nm Snapdragon 720G &Alexa Hands-Free Capable,₹34999.00,3.8 out of 5 stars,13 ratings,In stock.,OPPO Mobiles India Private Limited,India,Android 10.0,8 GB,18 x 9.2 x 6.1 cm, 186 Grams,1 A batteries required. (included),"Fingerprint, Accelerometer, Ambient light sensor, Proximity, E-compass and Gyroscope sensor, color temperature sensor",Smartphone,Onyx Black,4200,Packed with a host of features it scores high in terms of functionality. This makes it a must-have.,"Camera superb|| Not worth to buy|| Huge slimmest phone|| Best smartphone ""lite and loaded""|| Battery performances not satisfactory|| Mi 11 lite|| Features|| Such a Amazing Phone",5.0 out of 5 stars|| 5.0 out of 5 stars|| 5.0 out of 5 stars,"['Camera', 'Battery']"
147,Mi 11X 5G Cosmic Black 8GB RAM 128GB ROM | SD 870 | DisplayMate A+ rated E4 AMOLED|Upto 4000 Additional Exchange,₹6649.00,4.3 out of 5 stars,9 ratings,Out of stock.,Xiaomi,India,"Android 11, Funtouch OS 11.1",4 GB,16.3 x 0.9 x 7.8 cm, 300 Grams,1 Lithium ion batteries required. (included),"Dual nano SIM, Rear Camera, E-mail, Front Camera, SIM, GPS, Video Player, Music Player",Touchscreen Phone,Tuscany Coral,4000,About this item :___Capture the perfect shot every time get things done with the Google Assistant 1 enjoy an all-day battery and more.______Get everyone in the picture with Group Selfies—no selfie stick required. Snap portraits like a pro with Portrait Mode. Capture smiles not blinks for a great photo every time.______Pixel 3 comes with a battery that charges fast and wirelessly and lasts all day. It's even smart enough to limit battery usage for the apps you don't use often to keep you going longer.______Get help from the Google Assistant: reserve a table at your favorite restaurant buy tickets get commute times weather info and more—all with a simple squeeze or just by using your voice.______Screen spam scams and other nuisance calls. Get real-time transcription and block unwanted callers so you’ll never hear from them again.______Search what you see with Google Lens6 to look up clothing and home decor copy and translates text and identify landmarks plants and animals.,The worst phone ever purchased online.. Plz avoid this one.|| Mi 10i Review before you Buy.|| Camera Processor|| बेवकूफ बनाने की दुकान|| Don't buy it till nxt update comes|| Very Bad Experience|| Mi software problem with bad display quality|| Best for it's price|| It's not worthy mobile atleast at the time of writing review|| Great but could be better,1.0 out of 5 stars|| 5.0 out of 5 stars|| 1.0 out of 5 stars,"['Camera', 'Performance', 'Screen', 'Price', 'Build Quality']"
